{"schema":"orbital-replay/v1","title":"Illustrative motion demo","mode":"illustrative","duration_s":5863.694136639565,"provenance":[{"id":"hcw","kind":"illustrative","label":"Illustrative HCW motion only","description":"Nine generated schematic glyph trajectories. No real orbital measurements, network telemetry or inference requests. Use this explicitly illustrative mode when replay data is unavailable."}],"nodes":[{"id":"0","label":"Sat 00","position_source":"hcw","positions":[{"t_s":0.0,"rtn_m":[0.0,0.0,0.0]},{"t_s":48.864117805329705,"rtn_m":[0.0,0.0,0.0]},{"t_s":97.72823561065941,"rtn_m":[0.0,0.0,0.0]},{"t_s":146.59235341598912,"rtn_m":[0.0,0.0,0.0]},{"t_s":195.45647122131882,"rtn_m":[0.0,0.0,0.0]},{"t_s":244.32058902664855,"rtn_m":[0.0,0.0,0.0]},{"t_s":293.18470683197825,"rtn_m":[0.0,0.0,0.0]},{"t_s":342.048824637308,"rtn_m":[0.0,0.0,0.0]},{"t_s":390.91294244263764,"rtn_m":[0.0,0.0,0.0]},{"t_s":439.77706024796737,"rtn_m":[0.0,0.0,0.0]},{"t_s":488.6411780532971,"rtn_m":[0.0,0.0,0.0]},{"t_s":537.5052958586268,"rtn_m":[0.0,0.0,0.0]},{"t_s":586.3694136639565,"rtn_m":[0.0,0.0,0.0]},{"t_s":635.2335314692862,"rtn_m":[0.0,0.0,0.0]},{"t_s":684.097649274616,"rtn_m":[0.0,0.0,0.0]},{"t_s":732.9617670799456,"rtn_m":[0.0,0.0,0.0]},{"t_s":781.8258848852753,"rtn_m":[0.0,0.0,0.0]},{"t_s":830.690002690605,"rtn_m":[0.0,0.0,0.0]},{"t_s":879.5541204959347,"rtn_m":[0.0,0.0,0.0]},{"t_s":928.4182383012645,"rtn_m":[0.0,0.0,0.0]},{"t_s":977.2823561065942,"rtn_m":[0.0,0.0,0.0]},{"t_s":1026.146473911924,"rtn_m":[0.0,0.0,0.0]},{"t_s":1075.0105917172536,"rtn_m":[0.0,0.0,0.0]},{"t_s":1123.8747095225833,"rtn_m":[0.0,0.0,0.0]},{"t_s":1172.738827327913,"rtn_m":[0.0,0.0,0.0]},{"t_s":1221.6029451332427,"rtn_m":[0.0,0.0,0.0]},{"t_s":1270.4670629385723,"rtn_m":[0.0,0.0,0.0]},{"t_s":1319.3311807439022,"rtn_m":[0.0,0.0,0.0]},{"t_s":1368.195298549232,"rtn_m":[0.0,0.0,0.0]},{"t_s":1417.0594163545616,"rtn_m":[0.0,0.0,0.0]},{"t_s":1465.9235341598912,"rtn_m":[0.0,0.0,0.0]},{"t_s":1514.787651965221,"rtn_m":[0.0,0.0,0.0]},{"t_s":1563.6517697705506,"rtn_m":[0.0,0.0,0.0]},{"t_s":1612.5158875758802,"rtn_m":[0.0,0.0,0.0]},{"t_s":1661.38000538121,"rtn_m":[0.0,0.0,0.0]},{"t_s":1710.2441231865398,"rtn_m":[0.0,0.0,0.0]},{"t_s":1759.1082409918695,"rtn_m":[0.0,0.0,0.0]},{"t_s":1807.9723587971991,"rtn_m":[0.0,0.0,0.0]},{"t_s":1856.836476602529,"rtn_m":[0.0,0.0,0.0]},{"t_s":1905.7005944078587,"rtn_m":[0.0,0.0,0.0]},{"t_s":1954.5647122131884,"rtn_m":[0.0,0.0,0.0]},{"t_s":2003.428830018518,"rtn_m":[0.0,0.0,0.0]},{"t_s":2052.292947823848,"rtn_m":[0.0,0.0,0.0]},{"t_s":2101.1570656291774,"rtn_m":[0.0,0.0,0.0]},{"t_s":2150.0211834345073,"rtn_m":[0.0,0.0,0.0]},{"t_s":2198.885301239837,"rtn_m":[0.0,0.0,0.0]},{"t_s":2247.7494190451666,"rtn_m":[0.0,0.0,0.0]},{"t_s":2296.6135368504965,"rtn_m":[0.0,0.0,0.0]},{"t_s":2345.477654655826,"rtn_m":[0.0,0.0,0.0]},{"t_s":2394.341772461156,"rtn_m":[0.0,0.0,0.0]},{"t_s":2443.2058902664853,"rtn_m":[0.0,0.0,0.0]},{"t_s":2492.070008071815,"rtn_m":[0.0,0.0,0.0]},{"t_s":2540.9341258771447,"rtn_m":[0.0,0.0,0.0]},{"t_s":2589.7982436824745,"rtn_m":[0.0,0.0,0.0]},{"t_s":2638.6623614878044,"rtn_m":[0.0,0.0,0.0]},{"t_s":2687.526479293134,"rtn_m":[0.0,0.0,0.0]},{"t_s":2736.390597098464,"rtn_m":[0.0,0.0,0.0]},{"t_s":2785.2547149037932,"rtn_m":[0.0,0.0,0.0]},{"t_s":2834.118832709123,"rtn_m":[0.0,0.0,0.0]},{"t_s":2882.9829505144526,"rtn_m":[0.0,0.0,0.0]},{"t_s":2931.8470683197825,"rtn_m":[0.0,0.0,0.0]},{"t_s":2980.711186125112,"rtn_m":[-0.0,-0.0,0.0]},{"t_s":3029.575303930442,"rtn_m":[-0.0,-0.0,0.0]},{"t_s":3078.4394217357712,"rtn_m":[-0.0,-0.0,0.0]},{"t_s":3127.303539541101,"rtn_m":[-0.0,-0.0,0.0]},{"t_s":3176.167657346431,"rtn_m":[-0.0,-0.0,0.0]},{"t_s":3225.0317751517605,"rtn_m":[-0.0,-0.0,0.0]},{"t_s":3273.8958929570904,"rtn_m":[-0.0,-0.0,0.0]},{"t_s":3322.76001076242,"rtn_m":[-0.0,-0.0,0.0]},{"t_s":3371.62412856775,"rtn_m":[-0.0,-0.0,0.0]},{"t_s":3420.4882463730796,"rtn_m":[-0.0,-0.0,0.0]},{"t_s":3469.3523641784095,"rtn_m":[-0.0,-0.0,0.0]},{"t_s":3518.216481983739,"rtn_m":[-0.0,-0.0,0.0]},{"t_s":3567.080599789069,"rtn_m":[-0.0,-0.0,0.0]},{"t_s":3615.9447175943983,"rtn_m":[-0.0,-0.0,0.0]},{"t_s":3664.808835399728,"rtn_m":[-0.0,-0.0,0.0]},{"t_s":3713.672953205058,"rtn_m":[-0.0,-0.0,0.0]},{"t_s":3762.5370710103875,"rtn_m":[-0.0,-0.0,0.0]},{"t_s":3811.4011888157174,"rtn_m":[-0.0,-0.0,0.0]},{"t_s":3860.265306621047,"rtn_m":[-0.0,-0.0,0.0]},{"t_s":3909.1294244263768,"rtn_m":[-0.0,-0.0,0.0]},{"t_s":3957.993542231706,"rtn_m":[-0.0,-0.0,0.0]},{"t_s":4006.857660037036,"rtn_m":[-0.0,-0.0,0.0]},{"t_s":4055.7217778423656,"rtn_m":[-0.0,-0.0,0.0]},{"t_s":4104.585895647696,"rtn_m":[-0.0,-0.0,0.0]},{"t_s":4153.450013453025,"rtn_m":[-0.0,-0.0,0.0]},{"t_s":4202.314131258355,"rtn_m":[-0.0,-0.0,0.0]},{"t_s":4251.178249063685,"rtn_m":[-0.0,-0.0,0.0]},{"t_s":4300.042366869015,"rtn_m":[-0.0,-0.0,0.0]},{"t_s":4348.906484674344,"rtn_m":[-0.0,-0.0,0.0]},{"t_s":4397.770602479674,"rtn_m":[0.0,0.0,0.0]},{"t_s":4446.634720285003,"rtn_m":[0.0,0.0,0.0]},{"t_s":4495.498838090333,"rtn_m":[0.0,0.0,0.0]},{"t_s":4544.362955895663,"rtn_m":[0.0,0.0,0.0]},{"t_s":4593.227073700993,"rtn_m":[0.0,0.0,0.0]},{"t_s":4642.091191506322,"rtn_m":[0.0,0.0,0.0]},{"t_s":4690.955309311652,"rtn_m":[0.0,0.0,0.0]},{"t_s":4739.819427116981,"rtn_m":[0.0,0.0,0.0]},{"t_s":4788.683544922312,"rtn_m":[0.0,0.0,0.0]},{"t_s":4837.547662727641,"rtn_m":[0.0,0.0,0.0]},{"t_s":4886.411780532971,"rtn_m":[0.0,0.0,0.0]},{"t_s":4935.2758983383,"rtn_m":[0.0,0.0,0.0]},{"t_s":4984.14001614363,"rtn_m":[0.0,0.0,0.0]},{"t_s":5033.00413394896,"rtn_m":[0.0,0.0,0.0]},{"t_s":5081.868251754289,"rtn_m":[0.0,0.0,0.0]},{"t_s":5130.732369559619,"rtn_m":[0.0,0.0,0.0]},{"t_s":5179.596487364949,"rtn_m":[0.0,0.0,0.0]},{"t_s":5228.4606051702785,"rtn_m":[0.0,0.0,0.0]},{"t_s":5277.324722975609,"rtn_m":[0.0,0.0,0.0]},{"t_s":5326.188840780937,"rtn_m":[0.0,0.0,0.0]},{"t_s":5375.052958586268,"rtn_m":[0.0,0.0,0.0]},{"t_s":5423.917076391598,"rtn_m":[0.0,0.0,0.0]},{"t_s":5472.781194196928,"rtn_m":[0.0,0.0,0.0]},{"t_s":5521.645312002257,"rtn_m":[0.0,0.0,0.0]},{"t_s":5570.5094298075865,"rtn_m":[0.0,0.0,0.0]},{"t_s":5619.373547612917,"rtn_m":[0.0,0.0,0.0]},{"t_s":5668.237665418246,"rtn_m":[0.0,0.0,0.0]},{"t_s":5717.101783223576,"rtn_m":[0.0,0.0,0.0]},{"t_s":5765.965901028905,"rtn_m":[0.0,0.0,0.0]},{"t_s":5814.8300188342355,"rtn_m":[0.0,0.0,0.0]},{"t_s":5863.694136639565,"rtn_m":[0.0,0.0,0.0]}]},{"id":"1","label":"Sat 01","position_source":"hcw","positions":[{"t_s":0.0,"rtn_m":[-500.0,0.0,0.0]},{"t_s":48.864117805329705,"rtn_m":[-499.3147673772869,52.33595624294383,0.0]},{"t_s":97.72823561065941,"rtn_m":[-497.2609476841366,104.52846326765345,0.0]},{"t_s":146.59235341598912,"rtn_m":[-493.8441702975689,156.43446504023086,0.0]},{"t_s":195.45647122131882,"rtn_m":[-489.07380036690284,207.9116908177593,0.0]},{"t_s":244.32058902664855,"rtn_m":[-482.9629131445342,258.81904510252076,0.0]},{"t_s":293.18470683197825,"rtn_m":[-475.52825814757676,309.0169943749474,0.0]},{"t_s":342.048824637308,"rtn_m":[-466.7902132486009,358.3679495453003,0.0]},{"t_s":390.91294244263764,"rtn_m":[-456.77272882130046,406.73664307580015,0.0]},{"t_s":439.77706024796737,"rtn_m":[-445.5032620941839,453.9904997395468,0.0]},{"t_s":488.6411780532971,"rtn_m":[-433.01270189221935,499.99999999999994,0.0]},{"t_s":537.5052958586268,"rtn_m":[-419.33528397271203,544.639035015027,0.0]},{"t_s":586.3694136639565,"rtn_m":[-404.5084971874737,587.7852522924732,0.0]},{"t_s":635.2335314692862,"rtn_m":[-388.57298072848545,629.3203910498374,0.0]},{"t_s":684.097649274616,"rtn_m":[-371.5724127386971,669.1306063588582,0.0]},{"t_s":732.9617670799456,"rtn_m":[-353.5533905932738,707.1067811865474,0.0]},{"t_s":781.8258848852753,"rtn_m":[-334.5653031794291,743.1448254773942,0.0]},{"t_s":830.690002690605,"rtn_m":[-314.6601955249188,777.1459614569708,0.0]},{"t_s":879.5541204959347,"rtn_m":[-293.8926261462366,809.0169943749474,0.0]},{"t_s":928.4182383012645,"rtn_m":[-272.3195175075135,838.6705679454241,0.0]},{"t_s":977.2823561065942,"rtn_m":[-250.00000000000006,866.0254037844386,0.0]},{"t_s":1026.146473911924,"rtn_m":[-226.99524986977343,891.0065241883678,0.0]},{"t_s":1075.0105917172536,"rtn_m":[-203.3683215379001,913.5454576426009,0.0]},{"t_s":1123.8747095225833,"rtn_m":[-179.1839747726502,933.5804264972018,0.0]},{"t_s":1172.738827327913,"rtn_m":[-154.50849718747372,951.0565162951535,0.0]},{"t_s":1221.6029451332427,"rtn_m":[-129.4095225512605,965.9258262890683,0.0]},{"t_s":1270.4670629385723,"rtn_m":[-103.95584540887972,978.1476007338056,0.0]},{"t_s":1319.3311807439022,"rtn_m":[-78.21723252011546,987.6883405951378,0.0]},{"t_s":1368.195298549232,"rtn_m":[-52.264231633826725,994.5218953682732,0.0]},{"t_s":1417.0594163545616,"rtn_m":[-26.167978121471982,998.6295347545738,0.0]},{"t_s":1465.9235341598912,"rtn_m":[-3.061616997868383e-14,1000.0,0.0]},{"t_s":1514.787651965221,"rtn_m":[26.16797812147181,998.6295347545738,0.0]},{"t_s":1563.6517697705506,"rtn_m":[52.26423163382667,994.5218953682734,0.0]},{"t_s":1612.5158875758802,"rtn_m":[78.21723252011529,987.6883405951378,0.0]},{"t_s":1661.38000538121,"rtn_m":[103.95584540887955,978.1476007338057,0.0]},{"t_s":1710.2441231865398,"rtn_m":[129.40952255126032,965.9258262890684,0.0]},{"t_s":1759.1082409918695,"rtn_m":[154.50849718747367,951.0565162951536,0.0]},{"t_s":1807.9723587971991,"rtn_m":[179.18397477265003,933.5804264972019,0.0]},{"t_s":1856.836476602529,"rtn_m":[203.36832153790013,913.5454576426009,0.0]},{"t_s":1905.7005944078587,"rtn_m":[226.99524986977337,891.0065241883678,0.0]},{"t_s":1954.5647122131884,"rtn_m":[249.99999999999991,866.0254037844387,0.0]},{"t_s":2003.428830018518,"rtn_m":[272.3195175075136,838.6705679454241,0.0]},{"t_s":2052.292947823848,"rtn_m":[293.8926261462365,809.0169943749474,0.0]},{"t_s":2101.1570656291774,"rtn_m":[314.66019552491866,777.145961456971,0.0]},{"t_s":2150.0211834345073,"rtn_m":[334.5653031794291,743.1448254773942,0.0]},{"t_s":2198.885301239837,"rtn_m":[353.5533905932739,707.1067811865472,0.0]},{"t_s":2247.7494190451666,"rtn_m":[371.572